{
  "schema_version": 1,
  "id": "CHANGE.MODEL.TEST.DESTRUCTIVE_COMBINATION_MATRIX.20261007",
  "target_claim": "CLAIM.TEST.DESTRUCTIVE_COMBINATION_MATRIX",
  "operation": "expand",
  "from": {},
  "to": {
    "maturity": "experimental",
    "authority": "active",
    "epistemic_state": "challenged"
  },
  "reason": "Create Claim/Evidence representation for evidence-insufficient Experimental record TEST.DESTRUCTIVE_COMBINATION_MATRIX; no maturity promotion.",
  "evidence_refs": [
    "EVID.EXPERIMENTAL.TEST.DESTRUCTIVE_COMBINATION_MATRIX.01"
  ],
  "decided_by": "governance",
  "decided_at": "2026-10-07T00:00:00+00:00",
  "reversible": true,
  "replacement_claim": null
}
