{
  "schema_version": 1,
  "id": "CHANGE.MODEL.REL.CHECKPOINT.ROUTE_AND_INPUT_IDENTITY.20261007",
  "target_claim": "CLAIM.REL.CHECKPOINT.ROUTE_AND_INPUT_IDENTITY",
  "operation": "expand",
  "from": {},
  "to": {
    "maturity": "experimental",
    "authority": "active",
    "epistemic_state": "supported"
  },
  "reason": "Create Claim/Evidence representation for Experimental catalog record REL.CHECKPOINT.ROUTE_AND_INPUT_IDENTITY without promoting its maturity.",
  "evidence_refs": [
    "EVID.EXPERIMENTAL.REL.CHECKPOINT.ROUTE_AND_INPUT_IDENTITY.01",
    "EVID.EXPERIMENTAL.REL.CHECKPOINT.ROUTE_AND_INPUT_IDENTITY.02"
  ],
  "decided_by": "governance",
  "decided_at": "2026-10-07T00:00:00+00:00",
  "reversible": true,
  "replacement_claim": null
}
