{
  "schema_version": 1,
  "id": "CHANGE.MODEL.REL.LAST_KNOWN_GOOD_ROLLBACK.20261007",
  "target_claim": "CLAIM.REL.LAST_KNOWN_GOOD_ROLLBACK",
  "operation": "expand",
  "from": {},
  "to": {
    "maturity": "experimental",
    "authority": "active",
    "epistemic_state": "challenged"
  },
  "reason": "Create Claim/Evidence representation for evidence-insufficient Experimental record REL.LAST_KNOWN_GOOD_ROLLBACK; no maturity promotion.",
  "evidence_refs": [
    "EVID.EXPERIMENTAL.REL.LAST_KNOWN_GOOD_ROLLBACK.01",
    "EVID.EXPERIMENTAL.REL.LAST_KNOWN_GOOD_ROLLBACK.02"
  ],
  "decided_by": "governance",
  "decided_at": "2026-10-07T00:00:00+00:00",
  "reversible": true,
  "replacement_claim": null
}
